PMID	Year	Title
39438144	2024	Long COVID or Post-Acute Sequelae of COVID-19 (PASC) in Children and Adolescents.
39436613	2024	Associations between symptom-based long COVID clusters and long-term quality of life, work and daily activities among individuals testing positive for SARS-CoV-2 at a national retail pharmacy.
39436440	2024	A&#xa0;short story of long COVID.
39436395	2024	Prevalence and associations of insomnia after COVID-19 infection.
39435694	2024	Epigenetic changes in patients with post-acute COVID-19 symptoms (PACS) and long-COVID: A systematic review.
39435656	2024	Immune exhaustion in ME/CFS and long COVID.
39435149	2024	TLR2/NF-&#x3ba;B signaling in macrophage/microglia mediated COVID-pain induced by SARS-CoV-2 envelope protein.
39434957	2024	Fibrinaloid microclots in long COVID: assessing the actual evidence properly.
39434919	2024	Generative AI-based knowledge graphs for the illustration and development of mHealth self-management content.
39434281	2024	Factors affecting symptom duration and recovery among home-treated COVID- 19 patients in Baghdad-Iraq: a cross-sectional study.
39434179	2024	Telehealth-delivered cognitive rehabilitation for people with cognitive impairment as part of the post-COVID syndrome: protocol for a randomised controlled trial as part of the CICERO (Cognitive Impairment in Long COVID: Phenotyping and Rehabilitation) study.
39433997	2024	Caring for Long Covid patients in primary healthcare: a cross-sectional study on general practitioners' knowledge, perception and experience in Belgium and Malta.
39433942	2024	Finding Long-COVID: temporal topic modeling of electronic health records from the N3C and RECOVER programs.
39433402	2024	Long Covid: a global health issue - a prospective, cohort study set in four continents.
39430651	2024	Preprint pointers from a long COVID scoping review: considerations for source selection and searching.
39430594	2024	Understanding long COVID: prevalence, characteristics, and risk factors in the Eastern Province of Saudi Arabia.
39429966	2024	COVID-19 and multiple sclerosis: challenges and lessons for patient care.
39429741	2024	COVID-19 and persistent symptoms: implications for polycystic ovary syndrome and its management.
39429336	2024	COVID-19 Infection and Vaccination Effects on Breast Implant Illness: A Case Report.
39429158	2024	Cohort Profile: Post-Hospitalisation COVID-19 (PHOSP-COVID) study.
39428555	2024	Is There such a Thing as Post-Viral Depression?: Implications for Precision Medicine.
39426876	2024	[Mechanisms of prolonged symptoms following acute COVID-19: Some pathophysiological pathways].
39426837	2024	Respiratory syncytial virus (RSV) vaccine effectiveness against RSV-associated hospitalisations and emergency department encounters among adults aged 60 years and older in the USA, October, 2023, to March, 2024: a test-negative design analysis.
39425101	2024	Correction: Long COVID is not the same for everyone: a hierarchical cluster analysis of long COVID symptoms 9 and 12 months after SARS-CoV-2 test.
39425012	2024	The home-based breathing and chest mobility exercise improves cardiorespiratory functional capacity in long COVID with cardiovascular comorbidities: a randomized study.
39424264	2024	The tryptophan catabolite or kynurenine pathway in long COVID disease: A systematic review and meta-analysis.
39423876	2024	Trends of common laboratory biomarkers after SARS-CoV-2 infection.
39423759	2024	Analysis of fat oxidation capacity during cardiopulmonary exercise testing indicates long-lasting metabolic disturbance in patients with post-covid-19 syndrome.
39423742	2024	A nomogram to predict long COVID risk based on pre- and post-infection factors: Results from a cross-sectional study in South China.
39422912	2024	Time to Sustained Recovery Among Outpatients With COVID-19 Receiving Montelukast vs Placebo: The ACTIV-6 Randomized Clinical Trial.
39421860	2024	Long-term COVID-19 sequelae by Theta and SARS-CoV-2 variants in a Philippine cohort.
39420307	2024	Prevalence and exploratory factor analysis of long COVID-19 symptoms among experienced infected population in Bangkok, Thailand.
39419616	2024	Mapping the landscape of mental health and long COVID: a protocol for scoping review.
39419470	2024	HERV-W ENV transcription in B cells predicting symptomatic COVID-19 and risk for long COVID can express a full-length protein despite stop codon in mRNA from chromosome X via a ribosome readthrough.
39419167	2024	Temporal trajectories of long-COVID symptoms in adults with 22 months follow-up in a prospective cohort study in Norway.
39418956	2024	Sex, vaccination status, and comorbidities influence long COVID persistence.
39418782	2024	Effect of Long COVID on Work Performance and Annual Monetary Loss among Infected Healthcare Workers at a Tertiary Hospital in Malaysia.
39418080	2024	Impact of Concurrent Media Exposure on Professional Identity: Cross-Sectional Study of 1087 Medical Students During Long COVID.
39417730	2024	The negative effects of long COVID-19 on cardiovascular health and implications for the presurgical examination.
39417642	2024	Interactions between sleep, inflammation, immunity and infections: A narrative review.
